{
    "id": "builtin",
    "name": "Built-in rules",
    "blockGroups": {
        "latin-letters": {
            "name": "Latin letters",
            "note": "Only letter code points were included. The Latin Extended-F block has no letters, so it's empty",
            "blocks": [
                {
                    "name": "Basic Latin",
                    "ranges": [ [65, 90], [97, 122] ]
                },
                {
                    "name": "Latin-1 Supplement",
                    "ranges": [ [192, 214], [216, 246], [248, 255] ]
                },
                {
                    "name": "Latin Extended-A",
                    "ranges": [ [256, 383] ]
                },
                {
                    "name": "Latin Extended-B",
                    "ranges": [ [384, 591] ]
                },
                {
                    "name": "Latin Extended Additional",
                    "ranges": [ [7680, 7935] ]
                },
                {
                    "name": "Latin Extended-C",
                    "ranges": [ [11360, 11387], [11390, 11391] ]
                },
                {
                    "name": "Latin Extended-D",
                    "ranges": [ [42786, 42863], [42865, 42887], [42891, 42973], [42978, 42978], [42997, 42999], [43002, 43007] ]
                },
                {
                    "name": "Latin Extended-E",
                    "ranges": [ [43824, 43866], [43872, 43876], [43878, 43880], [43884, 43885] ]
                },
                {
                    "name": "Alphabetic Presentation Forms",
                    "ranges": [ [64256, 64262] ]
                },
                {
                    "name": "Halfwidth and Fullwidth Forms",
                    "ranges": [ [65313, 65338], [65345, 65370] ]
                },
                {
                    "name": "Latin Extended-F",
                    "ranges": []
                },
                {
                    "name": "Latin Extended-G",
                    "ranges": [ [122624, 122753], [122768, 122774], [122832, 122832] ]
                }
            ]
        },
        "cyrillic-letters": {
            "name": "Cyrillic letters",
            "note": "Only letter code points were included. The Cyrillic Extended-A and Cyrillic Extended-D blocks have no letters, so they're empty. Blocks are in code point ID order, which is why the Cyrillic Extended-C block is confusingly before the Cyrillic Extended-A block",
            "blocks": [
                {
                    "name": "Cyrillic",
                    "ranges": [ [1024, 1154], [1162, 1279] ]
                },
                {
                    "name": "Cyrillic Supplement",
                    "ranges": [ [1280, 1327] ]
                },
                {
                    "name": "Cyrillic Extended-C",
                    "ranges": [ [7296, 7306] ]
                },
                {
                    "name": "Cyrillic Extended-A",
                    "ranges": []
                },
                {
                    "name": "Cyrillic Extended-B",
                    "ranges": [ [42560, 42606], [42624, 42651] ]
                },
                {
                    "name": "Cyrillic Extended-D",
                    "ranges": []
                }
            ]
        }
    },
    "rules": {
        "nonstd-latin-rucyrillic": {
            "name": "Non-standard Latin to Russian Cyrillic",
            "description": "Non-standard transliteration rules which can be used with a US keyboard.\nSource: https://en.wikipedia.org/wiki/Russian_alphabet#Letters",
            "map": [
                ["a", "а"], ["b", "б"], ["v", "в"], ["g", "г"], ["d", "д"],
                ["ye", "е"], ["je", "е"], ["e", "е"], ["yo", "ё"], ["jo", "ё"],
                ["ë", "ё"], ["zh", "ж"], ["ž", "ж"], ["z", "з"], ["i", "и"],
                ["y", "й"], ["i", "й"], ["j", "й"], ["k", "к"], ["l", "л"],
                ["m", "м"], ["n", "н"], ["o", "о"], ["p", "п"], ["r", "р"],
                ["s", "с"], ["t", "т"], ["u", "у"], ["f", "ф"], ["kh", "х"],
                ["h", "х"], ["ts", "ц"], ["c", "ц"], ["ch", "ч"], ["č", "ч"],
                ["sh", "ш"], ["š", "ш"], ["shch", "щ"], ["sch", "щ"], ["šč", "щ"],
                ["śś", "щ"], ["\"", "ъ"], ["y", "ы"], ["'", "ь"], ["e", "э"],
                ["è", "э"], ["yu", "ю"], ["ju", "ю"], ["ya", "я"], ["ja", "я"]
            ],
            "inBlockGroups": ["builtin:latin-letters"],
            "outBlockGroups": ["builtin:cyrillic-letters"]
        },
        "cyrillisch": {
            "name": "Cyrillisch",
            "description": "A system for writing English with the Cyrillic alphabet, created by Niño Eduardo Evan Fernandez.\nSource: https://www.omniglot.com/conscripts/cyrillisch.htm",
            "map": [
                ["а", "a"], ["б", "b"], ["ч", "ch"], ["д", "d"], ["е", "e"],
                ["ф", "f"], ["г", "g"], ["х", "h"], ["и", "i"], ["џ", "j"],
                ["к", "k"], ["л", "l"], ["м", "m"], ["н", "n"], ["о", "o"],
                ["п", "p"], ["р", "r"], ["с", "s"], ["ш", "sch"], ["т", "t"],
                ["у", "u"], ["в", "v"], ["ў", "w"], ["қ", "x"], ["ј", "y"],
                ["з", "z"], ["э", "ä"], ["ң", "ng"], ["ц", "ts"], ["ж", "zh"],
                ["ћ", "th"], ["ђ", "dh"]
            ],
            "inBlockGroups": ["builtin:latin-letters"],
            "outBlockGroups": ["builtin:cyrillic-letters"]
        }
    }
}